{
  "schema_version": "control-plane/configuration/v2",
  "configuration_id": "demo_shop/configurations/1",
  "project_ref": "demo_shop",
  "requirements_ref": {
    "requirements_id": "demo_shop/requirements/1",
    "digest": "sha256:aeeb7017bd8c6a68057ac2cf5aeb3110e1e3bbc1fa6a864157756dc2086b49a9"
  },
  "template_ref": null,
  "variant_ref": null,
  "manifest": {
    "manifest_id": "demo_shop_platform",
    "manifest_version": "1.0.0",
    "predecessor": null
  },
  "components": [
    {
      "component_id": "identity",
      "component_version": "0.4.0"
    },
    {
      "component_id": "tenant_authority",
      "component_version": "0.1.0"
    }
  ],
  "configuration": {
    "identity": {
      "current_platform_id": "demo_shop_platform"
    },
    "tenant_authority": {
      "platform_id": "demo_shop_platform"
    }
  },
  "golden_bundle": null,
  "extensions": null,
  "branding": null,
  "attachments": {
    "proposal": null,
    "approval": null,
    "build": null,
    "release": null
  },
  "predecessor": null,
  "digest": "sha256:c58eafbcbd07b8624c912f6d1c5175ee3a2cf79d2f6a77f0795a4d53d0602257"
}
